=== Setup parent + child ===
DROP TABLE IF EXISTS fkc; DROP TABLE IF EXISTS fkp;
CREATE TABLE fkp (id INT PRIMARY KEY);
INSERT INTO fkp VALUES (1), (2);
=== ON DELETE CASCADE — parent delete removes children ===
CREATE TABLE fkc (id INT PRIMARY KEY, pid INT,
  FOREIGN KEY (pid) REFERENCES fkp(id) ON DELETE CASCADE);
INSERT INTO fkc VALUES (10, 1), (20, 1), (30, 2);
DELETE FROM fkp WHERE id = 1;
SELECT id, pid FROM fkc ORDER BY id;
id	pid
30	2
=== ON DELETE SET NULL ===
DROP TABLE IF EXISTS fksc; DROP TABLE IF EXISTS fksp;
CREATE TABLE fksp (id INT PRIMARY KEY);
CREATE TABLE fksc (id INT PRIMARY KEY, pid INT,
  FOREIGN KEY (pid) REFERENCES fksp(id) ON DELETE SET NULL);
INSERT INTO fksp VALUES (1);
INSERT INTO fksc VALUES (10, 1);
DELETE FROM fksp WHERE id = 1;
SELECT id, pid FROM fksc;
id	pid
10	NULL
=== ON DELETE RESTRICT — errors when children exist ===
DROP TABLE IF EXISTS fkrc; DROP TABLE IF EXISTS fkrp;
CREATE TABLE fkrp (id INT PRIMARY KEY);
CREATE TABLE fkrc (id INT PRIMARY KEY, pid INT,
  FOREIGN KEY (pid) REFERENCES fkrp(id) ON DELETE RESTRICT);
INSERT INTO fkrp VALUES (1);
INSERT INTO fkrc VALUES (10, 1);
DELETE FROM fkrp WHERE id = 1;
ERROR 1105: foreign key violation: update or delete on table "test.public.fkrp" violates foreign key constraint "test.public.fkrc_pid_fkey" on table "test.public.fkrc"
=== Self-referencing FK ===
DROP TABLE IF EXISTS fself;
CREATE TABLE fself (id INT PRIMARY KEY, parent_id INT,
  FOREIGN KEY (parent_id) REFERENCES fself(id));
INSERT INTO fself VALUES (1, NULL), (2, 1), (3, 2);
SELECT id, parent_id FROM fself ORDER BY id;
id	parent_id
1	NULL
2	1
3	2
=== Composite FK (multi-column REFERENCES) ===
DROP TABLE IF EXISTS fkmc; DROP TABLE IF EXISTS fkmp;
CREATE TABLE fkmp (a INT, b INT, PRIMARY KEY (a, b));
CREATE TABLE fkmc (id INT PRIMARY KEY, a INT, b INT,
  FOREIGN KEY (a, b) REFERENCES fkmp(a, b));
INSERT INTO fkmp VALUES (1, 10), (2, 20);
INSERT INTO fkmc VALUES (100, 1, 10), (200, 2, 20);
SELECT id, a, b FROM fkmc ORDER BY id;
id	a	b
100	1	10
200	2	20
=== FK violation on missing parent — errno 1105 ===
INSERT INTO fkmc VALUES (300, 9, 99);
ERROR 1105: foreign key violation: insert or update on table "test.public.fkmc" violates foreign key constraint "test.public.fkmc_a_b_fkey": key is not present in table "test.public.fkmp"
=== NULL in FK column — allowed (no parent required) ===
DROP TABLE IF EXISTS fknull_c; DROP TABLE IF EXISTS fknull_p;
CREATE TABLE fknull_p (id INT PRIMARY KEY);
CREATE TABLE fknull_c (id INT PRIMARY KEY, pid INT,
  FOREIGN KEY (pid) REFERENCES fknull_p(id));
INSERT INTO fknull_c VALUES (1, NULL);
SELECT id, pid FROM fknull_c;
id	pid
1	NULL
=== DEFERRABLE INITIALLY DEFERRED — accepted (no actual deferral) ===
DROP TABLE IF EXISTS fkdc; DROP TABLE IF EXISTS fkdp;
CREATE TABLE fkdp (id INT PRIMARY KEY);
CREATE TABLE fkdc (id INT PRIMARY KEY, pid INT,
  FOREIGN KEY (pid) REFERENCES fkdp(id) DEFERRABLE INITIALLY DEFERRED);
=== KNOWN DIVERGENCE: ON UPDATE CASCADE — errno 1105 ===
# zeta doesn't allow updating PK columns of an existing
# row in-place, so ON UPDATE CASCADE can never fire.
DROP TABLE IF EXISTS fkuc; DROP TABLE IF EXISTS fkup;
CREATE TABLE fkup (id INT PRIMARY KEY);
CREATE TABLE fkuc (id INT PRIMARY KEY, pid INT,
  FOREIGN KEY (pid) REFERENCES fkup(id) ON UPDATE CASCADE);
INSERT INTO fkup VALUES (1);
INSERT INTO fkuc VALUES (10, 1);
UPDATE fkup SET id = 100 WHERE id = 1;
ERROR 1105: execution error: UPDATE of primary key column 'id' is not supported
=== Cleanup ===
DROP TABLE fkuc; DROP TABLE fkup;
DROP TABLE fkdc; DROP TABLE fkdp;
DROP TABLE fknull_c; DROP TABLE fknull_p;
DROP TABLE fkmc; DROP TABLE fkmp;
DROP TABLE fself;
DROP TABLE fkrc; DROP TABLE fkrp;
DROP TABLE fksc; DROP TABLE fksp;
DROP TABLE fkc; DROP TABLE fkp;
